{
 "id": "T17",
 "spec": "SYNC.md §8 T17",
 "title": "Profile: A sets conditions.nearLondon, B sets controllerMaps.qo100wb.ajazz-akp03e: both kept",
 "start": "2026-10-09T10:00:00Z",
 "controllers": {
  "C1": {
   "name": "GM4BRI",
   "users": {
    "brian": {
     "password": "pw",
     "transmit": true
    }
   }
  }
 },
 "stores": {
  "A": {},
  "B": {}
 },
 "steps": [
  {
   "do": "pair",
   "store": "A",
   "controller": "C1"
  },
  {
   "do": "pair",
   "store": "B",
   "controller": "C1"
  },
  {
   "do": "profile",
   "store": "A",
   "set": {
    "conditions": {
     "nearLondon": true
    }
   }
  },
  {
   "do": "profile",
   "store": "B",
   "set": {
    "controllerMaps": {
     "qo100wb": {
      "ajazz-akp03e": {
       "pages": [
        {
         "K1": {
          "press": "transmit"
         }
        }
       ]
      }
     }
    }
   }
  },
  {
   "do": "sync",
   "store": "A"
  },
  {
   "do": "sync",
   "store": "B"
  },
  {
   "do": "sync",
   "store": "A"
  }
 ],
 "expect": [
  {
   "profile": {
    "where": [
     "A",
     "B"
    ],
    "has": {
     "conditions": {
      "nearLondon": true
     },
     "controllerMaps": {
      "qo100wb": {
       "ajazz-akp03e": {
        "pages": [
         {
          "K1": {
           "press": "transmit"
          }
         }
        ]
       }
      }
     }
    }
   }
  },
  {
   "record": {
    "where": [
     "C1"
    ],
    "collection": "profile",
    "id": "station",
    "fields": {
     "conditions.nearLondon": true
    }
   }
  }
 ],
 "runner": "script"
}
