{
 "id": "T20",
 "spec": "SYNC.md §8 T20",
 "title": "Delete on A; B offline 30 days, then syncs: B sees it deleted",
 "start": "2026-10-09T10:00:00Z",
 "controllers": {
  "C1": {
   "name": "GM4BRI",
   "users": {
    "brian": {
     "password": "pw",
     "transmit": true
    }
   }
  }
 },
 "stores": {
  "A": {},
  "B": {}
 },
 "steps": [
  {
   "do": "pair",
   "store": "A",
   "controller": "C1"
  },
  {
   "do": "add",
   "store": "A",
   "id": "00000000-0000-7000-8000-000000000001",
   "fields": {
    "call": "DL1ABC",
    "start": "2026-10-09T10:12:30Z"
   }
  },
  {
   "do": "sync",
   "store": "A"
  },
  {
   "do": "pair",
   "store": "B",
   "controller": "C1"
  },
  {
   "do": "offline",
   "controller": "C1",
   "value": true
  },
  {
   "do": "sync",
   "store": "B",
   "expectState": "offline"
  },
  {
   "do": "offline",
   "controller": "C1",
   "value": false
  },
  {
   "do": "delete",
   "store": "A",
   "id": "00000000-0000-7000-8000-000000000001"
  },
  {
   "do": "sync",
   "store": "A"
  },
  {
   "do": "offline",
   "controller": "C1",
   "value": true
  },
  {
   "do": "tick",
   "ms": 2592000000
  },
  {
   "do": "sync",
   "store": "B",
   "expectState": "offline"
  },
  {
   "do": "offline",
   "controller": "C1",
   "value": false
  },
  {
   "do": "sync",
   "store": "B"
  }
 ],
 "expect": [
  {
   "record": {
    "where": [
     "A",
     "B",
     "C1"
    ],
    "collection": "logbook",
    "id": "00000000-0000-7000-8000-000000000001",
    "live": false
   }
  }
 ],
 "runner": "script"
}
