{
 "id": "T7",
 "spec": "SYNC.md §8 T7",
 "title": "Store A's clock 2 h slow edits after pulling B's value: A's edit wins (receive rule)",
 "start": "2026-10-09T10:00:00Z",
 "controllers": {
  "C1": {
   "name": "GM4BRI",
   "users": {
    "brian": {
     "password": "pw",
     "transmit": true
    }
   }
  }
 },
 "stores": {
  "A": {
   "skewMs": -7200000
  },
  "B": {}
 },
 "steps": [
  {
   "do": "pair",
   "store": "B",
   "controller": "C1"
  },
  {
   "do": "add",
   "store": "B",
   "id": "00000000-0000-7000-8000-000000000001",
   "fields": {
    "call": "DL1ABC",
    "start": "2026-10-09T10:12:30Z",
    "rst_rcvd": "55"
   }
  },
  {
   "do": "sync",
   "store": "B"
  },
  {
   "do": "pair",
   "store": "A",
   "controller": "C1"
  },
  {
   "do": "skew",
   "who": "A",
   "ms": -7200000,
   "resetOffset": true
  },
  {
   "do": "update",
   "store": "A",
   "id": "00000000-0000-7000-8000-000000000001",
   "fields": {
    "rst_rcvd": "59"
   }
  },
  {
   "do": "sync",
   "store": "A"
  },
  {
   "do": "sync",
   "store": "B"
  }
 ],
 "expect": [
  {
   "record": {
    "where": [
     "A",
     "B",
     "C1"
    ],
    "collection": "logbook",
    "id": "00000000-0000-7000-8000-000000000001",
    "live": true,
    "fields": {
     "rst_rcvd": "59"
    }
   }
  }
 ],
 "runner": "script"
}
